מאַחֲרַי הַמַּבּוּל,לא אכפת לי מה שיקרה אחרי מותי אפילו תבוא כליה על האנושות ובלבד שלא תבוא בימי
מַבּוּעַ,•מעיין/מקור מים/מקום שהמים נובעים ממנו •בהשאלה: מקור/יסוד/מוצא
מְבוּקָה,ריקנות, שממה,ראו את הערך בוקה ומבוקה (מבולקה)
מַבְחֵשׁ,בחשה/תרווד/כף גדולה לבחישה,זה בסדר אם אתה בוחש בשוקו
מַבְכִּירָה,•אישה היולדת בכור/אישה בלידתה הראשונה •בהמה הממליטה המלטה ראשונה
מֻבְלַעַת,מובלעה/אנקלווה/חבל ארץ במדינה המוקף כולו או רובו בשטחה של מדינה אחרת	
מְבֻלָּק,הרוס/פרוץ/מנותץ	
מְבֻסָּם / מְבֻשָּׂם, •שיכור,שתוי •ערב לחך/טעים,ברור שלכל השיכורים יש ריח מבוסם ומדהים
מבצעה,מכשיר לבציעת (פריסת) הלחם
מבצרה,מכשיר הדומה למזמרה המשמש לבצירת הענבים	
מברא,כורת יער
מָג,קוסם/מכשף/מגוש,מכאן- רב מג- ראש הקוסמים, מגי- קסום, מגיה- קסם, כישוף, 
מְגֻבָּב (מגובב),מוערם/מוטל ומונח זה על זה בערימה/בגיבוב
מַגְבֵּהַּ,ג'ק במכונית
מִגְבָּהּ,מגבית/שנור/איסוף כספים מחייבים או מנדבנים
מֶגֶד,מתק/טוב/מכאן- מיני מגדים – שמשמעותם ממתקים/תקרובת שמגישים לאורח/כיבוד מתוק/המגיד- שמשמעותו המתיק, הנעים/מגדן- ממתק או מתנה/מגדנית- סוכרייה/ממתק
מִגְדַּל שֵׁן,כינוי למקום רם ונעלה/מקום התבודדות של אחד שחושב שהוא מעל כולם 
מַגְדֶּלֶת,זכוכית מגדלת
מַגִּיהַּ,מתקן שגיאות ושיבושים,מכאן- מוגה- שמשמעו מתוקן/ללא שגיאות/אחרי שעבר עליו המגיה
מָגוֹב,מגרפה,כמו מגב
מָגוֹד,קולב
מְגוּפָה,מכסה/כיסוי/גולל/מסתם/פקק
מָגוֹר,פחד/יראה/מורא,לכן יש מטען חבלה בשם כלי מגור/או את גילה אלמגור/שהיא גילה אל-פחד
מִגּוּר (מיגור),השמדה/הבסה/הנחלת תבוסה,מה שרוצים לעשות לערבים מגר אותם
מְגוּרָה, •אסם/מטמורה/מחסן לשמירת תבואה או פירות •מאגר/מקום ריכוז למים •מדור/תא •מעון/דירה/מקום לגור בו,נשמע כמו מגירה או קצת כמו אגורה
מגורר,שעשו אותו עם פומפיה,עושה גרגירים